{"contractVersion":"0.1.0","jobId":"job_k1","stage":"storyKnowledge","projectId":"prj_f1","chapterId":"chp_f1","sourceVersionId":"srcv_f1","status":"partially_succeeded","items":[{"scopeKey":"fact:1","status":"succeeded","value":{"id":"fact_f1","factType":"event","statement":"少年灵纹觉醒","assertionKind":"explicit","resolutionStatus":"resolved","resolutionGroupId":null,"evidence":[{"sourceVersionId":"srcv_f1","fragmentId":"frag_f1"}]}},{"scopeKey":"fact:2","status":"failed","error":{"code":"AMBIGUOUS_IDENTITY","message":"称谓无法确定","retryable":true}}]}
